Id,EUde,EUen,EUit,EUnl,EUru,EUfr,EUes,USen,USfr,USes,JPja,KRko,TWzh,CNzh
InsectToy_05922,Sägez.-Hirschkäfermodell,saw stag model,replica di coleottero cervo,modelzaaghertkever,модель жука-оленя,modèle de lucane inclinatus,figura esc. ciervo sierra,saw stag model,modèle de lucane inclinatus,figura esc. ciervo sierra,ノコギリクワガタのもけい,톱사슴벌레 모형,鋸鍬形蟲模型,锯锹形虫模型
InsectToy_05924,Mega-Herkuleskäf.-Modell,grand h. hercules model,replica XL scarabeo Ercole,modelherculeskever XL,модель жука-геркулеса,modèle du Roi Dynaste,estatua es. astado hércules,grand h. hercules model,modèle du Roi Dynaste,estatua es. astado hércules,おおいなるカブトのもけい,위대한 장수풍뎅이 모형,巨大獨角仙模型,巨大兜虫模型
InsectToy_05927,Wespenmodell,wasp model,replica di vespa,modelwesp,модель осы,modèle de guêpe,figura de avispa,wasp model,modèle de guêpe,figura de avispa,ハチのもけい,벌 모형,黃蜂模型,黄蜂模型
InsectToy_05928,Honigbienenmodell,honeybee model,replica di ape operaia,modelhoningbij,модель восковой пчелы,modèle d'abeille naine,figura de abeja melífera,honeybee model,modèle d'abeille naine,figura de abeja melífera,ミツバチのもけい,꿀벌 모형,蜜蜂模型,蜜蜂模型
InsectToy_05929,Goldskarabäusmodell,scarab beetle model,replica di chrysina resplen.,modelscarabee,модель золотого скарабея,modèle de scarabée,figura de escarabajo oro,scarab beetle model,modèle de scarabée,figura de escarabajo oro,プラチナコガネのもけい,보석풍뎅이 모형,寶石金龜模型,宝石金龟模型
InsectToy_05935,Flohmodell,flea model,replica di pulce,modelvlo,модель блохи,modèle de puce,figura de pulga,flea model,modèle de puce,figura de pulga,ノミのもけい,벼룩 모형,跳蚤模型,跳蚤模型
InsectToy_05936,Mückenmodell,mosquito model,replica di zanzara,modelmug,модель комара,modèle de moustique,figura de mosquito,mosquito model,modèle de moustique,figura de mosquito,カのもけい,모기 모형,蚊子模型,蚊子模型
InsectToy_05938,Nashornkäfermodell,horned dynastid model,replica scarab. kabutomushi,modelneushoornkever,модель дупляка,modèle de scarabée kabuto,figura esc. astado japonés,horned dynastid model,modèle de scarabée kabuto,figura esc. astado japonés,カブトムシのもけい,장수풍뎅이 모형,獨角仙模型,独角仙模型
InsectToy_05944,Schwalbenschwanzmodell,tiger butterfly model,replica di farfalla tigre,modelkoninginnenpage,модель махаона,modèle de machaon,figura de mariposa tigre,tiger butterfly model,modèle de machaon,figura de mariposa tigre,アゲハチョウのもけい,호랑나비 모형,鳳蝶模型,凤蝶模型
InsectToy_07046,Braunzikadenmodell,brown cicada model,replica di cicala marrone,model-bruine-cicade,модель коричнев. цикады,modèle de cigale cercope,figura de cigarra marrón,brown cicada model,modèle de cigale cercope,figura de cigarra marrón,アブラゼミのもけい,유지매미 모형,油蟬模型,油蝉模型
InsectToy_07049,Troides-brookiana-Modell,R. Brooke's birdwing model,replica farfalla Raja Brooke,model-Rajah-Brooke-vlinder,модель трогоноптеры Бр.,modèle troides brookiana,figura mariposa alas Brooke,R. Brooke's birdwing model,modèle troides brookiana,figura mariposa alas Brooke,アカエリトリバネアゲハのもけい,붉은목도리비단나비 모형,紅頸鳳蝶模型,红颈凤蝶模型
InsectToy_07050,Feuerlibellenmodell,red dragonfly model,replica di libellula rossa,model-rode-libel,модель красной стрекозы,modèle de sympetrum,figura de libélula roja,red dragonfly model,modèle de libellule rouge,figura de libélula roja,アキアカネのもけい,고추잠자리 모형,紅蜻蜓模型,红蜻蜓模型
InsectToy_07051,Mega-Vogelfaltermodell,grand Q. A. birdwing model,replica XL farfalla regina A.,model-A.-vogelvlinder XL,модель птицекрылки Ал.,modèle du Roi Papillon,estatua marip. alas pájaro,grand Q. A. birdwing model,modèle du Roi Papillon,estatua marip. alas pájaro,おおいなるチョウのもけい,위대한 나비 모형,巨大蝴蝶模型,巨大蝴蝶模型
InsectToy_07052,Wasserläufermodell,pondskater model,replica di gerride,modelschaatsenrijder,модель водомерки,modèle de patineur,figura de zapatero,pondskater model,modèle de patineur,figura de zapatero,アメンボのもけい,소금쟁이 모형,水黽模型,水黾模型
InsectToy_07053,Ameisenmodell,ant model,replica di formica,modelmier,модель муравья,modèle de fourmi,figura de hormiga,ant model,modèle de fourmi,figura de hormiga,アリのもけい,개미 모형,螞蟻模型,蚂蚁模型
InsectToy_07054,Kugelasselmodell,pill bug model,replica di porcellino di terra,modelpissebed,модель мокрицы,modèle de cloporte,figura de cochinilla,pill bug model,modèle de cloporte,figura de cochinilla,ダンゴムシのもけい,공벌레 모형,鼠婦模型,鼠妇模型
InsectToy_07055,Ligia-exotica-Modell,wharf roach model,replica di ligia exotica,modelstrandpissebed,модель морского таракана,modèle de ligie,figura cochinilla de arena,wharf roach model,modèle de ligie,figura cochinilla de arena,フナムシのもけい,갯강구 모형,海蟑螂模型,海蟑螂模型
InsectToy_07056,Mottenmodell,moth model,replica di falena,modelmot,модель павлиноглазки,modèle de papillon de nuit,figura de polilla,moth model,modèle de papillon de nuit,figura de polilla,ガのもけい,나방 모형,飛蛾模型,飞蛾模型
InsectToy_07057,Schwimmkäfermodell,diving beetle model,replica di ditisco,modelwaterroofkever,модель плавунца,modèle de dytique,figura escarabajo nadador,diving beetle model,modèle de dytique,figura escarabajo nadador,ゲンゴロウのもけい,물방개 모형,龍蝨模型,龙虱模型
InsectToy_07058,Königslibellenmodell,darner dragonfly model,replica di libellula depressa,model-zuidelijke-keizerlibel,модель дозорщика,modèle d'anax napolitain,figura libélula cab. diablo,darner dragonfly model,modèle d'anax napolitain,figura libélula cab. diablo,ギンヤンマのもけい,왕잠자리 모형,綠胸晏蜓模型,绿胸晏蜓模型
InsectToy_07059,Mega-Goliathkäfermodell,grand goliath beetle model,replica XL scarabeo Golia,modelgoliathkever XL,модель жука-голиафа,modèle du Roi Scarabée,estatua de goliat,grand goliath beetle model,modèle du Roi Scarabée,estatua de goliat,おおいなるハナムグリのもけい,위대한 꽃무지 모형,巨大花金龜模型,巨大花金龟模型
InsectToy_07060,Fliegenmodell,fly model,replica di mosca,modelvlieg,модель мухи,modèle de mouche,figura de mosca,fly model,modèle de mouche,figura de mosca,ハエのもけい,파리 모형,蒼蠅模型,苍蝇模型
InsectToy_07061,Orchideenmantismodell,orchid mantis model,replica di mantide orchidea,model-orch.-bidsprinkhaan,модель орхид. богомола,modèle de mante orchidée,figura de mantis orquídea,orchid mantis model,modèle de mante orchidée,figura de mantis orquídea,ハナカマキリのもけい,연꽃사마귀 모형,蘭花螳螂模型,兰花螳螂模型
InsectToy_07062,Sandlaufkäfermodell,tiger beetle model,replica di cicindela,modelzandloopkever,модель жука-скакуна,modèle de cicindèle,figura de escarabajo tigre,tiger beetle model,modèle de cicindèle,figura de escarabajo tigre,ハンミョウのもけい,길앞잡이 모형,虎甲蟲模型,虎甲虫模型
InsectToy_07063,Abendzikadenmodell,evening cicada model,replica di cicala notturna,modelavondcicade,модель ночной цикады,modèle de cigale higurashi,figura de cigarrilla,evening cicada model,modèle de cigale higurashi,figura de cigarra,ヒグラシのもけい,쓰르라미 모형,暮蟬模型,暮蝉模型
InsectToy_07064,Cyclommatusmodell,cyclommatus stag model,replica di col. cyclommatus,model-vliegend-hert,модель жука-рогача,modèle lucane cyclommatus,figura esc. cyclommatus,cyclommatus stag model,modèle lucane cyclommatus,figura esc. cyclommatus,ホソアカクワガタのもけい,엘라푸스가위사슴벌레 모형,細身赤鍬形蟲模型,细身赤锹形虫模型
InsectToy_07065,Leuchtkäfermodell,firefly model,replica di lucciola,modelvuurvliegje,модель светлячка,modèle de luciole,figura de luciérnaga,firefly model,modèle de luciole,figura de luciérnaga,ホタルのもけい,반디 모형,螢火蟲模型,萤火虫模型
InsectToy_07066,Mistkäfermodell,dung beetle model,replica scarabeo stercorario,modelmestkever,модель жука-навозника,modèle de bousier,figura escarabajo pelotero,dung beetle model,modèle de bousier,figura escarabajo pelotero,フンコロガシのもけい,쇠똥구리 모형,糞金龜模型,蜣螂模型
InsectToy_07067,Heuschreckenmodell,rice grasshopper model,replica di locusta,modelrijstsprinkhaan,модель рисовой кобылки,modèle de criquet,figura de langosta,rice grasshopper model,modèle de criquet,figura de langosta,イナゴのもけい,메뚜기 모형,稻蝗模型,稻蝗模型
InsectToy_07068,Gottesanbeterinnenmodell,mantis model,replica di mantide,modelbidsprinkhaan,модель богомола,modèle de mante religieuse,figura de mantis religiosa,mantis model,modèle de mante religieuse,figura de mantis religiosa,カマキリのもけい,사마귀 모형,螳螂模型,螳螂模型
InsectToy_07069,Stinkwanzenmodell,stinkbug model,replica di cimice,modelschildwants,модель щитника,modèle de punaise,figura de chinche,stinkbug model,modèle de punaise,figura de chinche,カメムシのもけい,노린재 모형,椿象模型,椿象模型
InsectToy_07070,Fichtenbockmodell,citrus long-horned b. model,replica di tarlo asiatico,model-Aziatische-boktor,модель цитрусового усача,modèle de capricorne,figura longicornio asiático,citrus long-horned b. model,mod. capric. des agrumes,figura longicornio asiático,ゴマダラカミキリのもけい,알락하늘소 모형,星天牛模型,星天牛模型
InsectToy_07071,Ritterfaltermodell,peacock butterfly model,replica di farfalla vanessa io,modelpauwenpage,модель бианора,modèle de papilio bianor,figura de mariposa bianor,peacock butterfly model,modèle de papilio bianor,figura de mariposa bianor,カラスアゲハのもけい,제비나비 모형,烏鴉鳳蝶模型,乌鸦凤蝶模型
InsectToy_07072,Schneckenmodell,snail model,replica di chiocciola,modelslak,модель улитки,modèle d'escargot,figura de caracol,snail model,modèle d'escargot,figura de caracol,カタツムリのもけい,달팽이 모형,蝸牛模型,蜗牛模型
InsectToy_07073,Grashüpfermodell,grasshopper model,replica di cavalletta,modelsprinkhaan,модель кузнечика,modèle de sauterelle,figura de saltamontes,grasshopper model,modèle de sauterelle,figura de saltamontes,キリギリスのもけい,여치 모형,蚱蜢模型,蚱蜢模型
InsectToy_07074,Gold-Mistkäfermodell,earth-boring dung b. model,replica di geotrupidae,model-echte-mestkever,модель навозника-землер.,modèle de geotrupidae,figura escarab. geotrúpido,earth-boring dung b. model,modèle de géotrupe,figura escarab. geotrúpido,オオセンチコガネのもけい,보라금풍뎅이 모형,雪隱金龜模型,雪隐金龟模型
InsectToy_07075,Atlaskäfermodell,horned atlas model,replica di scarabeo atlas,modelatlaskever,модель жука-атласа,modèle de scarabée Atlas,figura esc. astado atlas,horned atlas model,modèle de scarabée Atlas,figura esc. astado atlas,コーカサスオオカブトのもけい,코카서스장수풍뎅이 모형,高卡薩斯南洋大兜蟲模型,高卡萨斯南洋大兜虫模型
InsectToy_07076,Blattschreckenmodell,walking leaf model,replica di insetto foglia,model-wandelend-blad,модель листотела,modèle de phyllie,figura de insecto hoja,walking leaf model,modèle de phyllie,figura de insecto hoja,コノハムシのもけい,잎사귀벌레 모형,葉竹節蟲模型,叶竹节虫模型
InsectToy_07077,Grillenmodell,cricket model,replica di grillo,modelkrekel,модель сверчка,modèle de grillon des prés,figura de grillo común,cricket model,modèle de grillon des prés,figura de grillo común,コオロギのもけい,귀뚜라미 모형,蟋蟀模型,蟋蟀模型
InsectToy_07078,Riesenzikadenmodell,giant cicada model,replica di cicala gigante,modelreuzencicade,модель гигантской цикады,modèle de cigale géante,figura de cigarra gigante,giant cicada model,modèle de cigale géante,figura de cigarra gigante,クマゼミのもけい,곰매미 모형,熊蟬模型,熊蝉模型
InsectToy_07079,Spinnenmodell,spider model,replica di ragno,modelspin,модель паука,modèle d'araignée,figura de araña,spider model,modèle d'araignée,figura de araña,クモのもけい,거미 모형,蜘蛛模型,蜘蛛模型
InsectToy_07080,Agrias-Faltermodell,agrias butterfly model,replica di farfalla agrias,modelagriasvlinder,модель агриаса клаудина,modèle d'agrias,figura de mariposa narciso,agrias butterfly model,modèle d'agrias,figura de mariposa narciso,ミイロタテハのもけい,아그리아스나비 모형,彩襖蛺蝶模型,彩袄蛱蝶模型
InsectToy_07081,Hyalessa-Zikadenmodell,robust cicada model,replica di cicala robusta,model-minmin-cicade,модель певчей цикады,modèle de cigale hyalessa,figura de cigarra oriental,robust cicada model,modèle de cigale hyalessa,figura de cigarra oriental,ミンミンゼミのもけい,참매미 모형,斑透翅蟬模型,斑透翅蝉模型
InsectToy_07082,Sackträgermodell,bagworm model,replica di bruco dal fodero,modelzakjesdrager,модель мешочницы,modèle de psyché,figura de oruga de bolsón,bagworm model,modèle de psyché,figura de oruga de bolsón,ミノムシのもけい,도롱이벌레 모형,蓑衣蟲模型,蓑衣虫模型
InsectToy_07083,Hirschkäfermodell,miyama stag model,replica coleottero lucanide,model-Miyama-hertkever,модель горн. жука-оленя,modèle de lucane miyama,figura esc. ciervo Miyama,miyama stag model,modèle de lucane miyama,figura esc. ciervo Miyama,ミヤマクワガタのもけい,사슴벌레 모형,深山鍬形蟲模型,深山锹形虫模型
InsectToy_07084,Zitronenfaltermodell,yellow butterfly model,replica di farfalla gialla,modelcitroenvlinder,модель желтушки,modèle de citrin,figura de mariposa colias,yellow butterfly model,modèle de citrin,figura de mariposa colias,モンキチョウのもけい,노랑나비 모형,斑緣點粉蝶模型,斑缘点粉蝶模型
InsectToy_07085,Kohlweißlingmodell,common butterfly model,replica di farfalla comune,modelkoolwitje,модель белянки,modèle de piéride,figura de mariposa común,common butterfly model,modèle piéride de la rave,figura de mariposa común,モンシロチョウのもけい,배추흰나비 모형,白粉蝶模型,白粉蝶模型
InsectToy_07086,Himmelsfaltermodell,emperor butterfly model,replica di farfalla morfo blu,model-blauwe-morpho,модель морфо менелая,modèle de morpho bleu,figura de mariposa celeste,emperor butterfly model,modèle de morpho bleu,figura de mariposa celeste,モルフォチョウのもけい,몰포나비 모형,大藍閃蝶模型,大蓝闪蝶模型
InsectToy_07087,Stabschreckenmodell,walking stick model,replica di insetto stecco,model-wandelende-tak,модель палочника,modèle de phasme,figura de insecto palo,walking stick model,modèle de phasme,figura de insecto palo,ナナフシのもけい,긴수염대벌레 모형,竹節蟲模型,竹节虫模型
InsectToy_07088,Pracht-Hirschkäfermodell,rainbow stag model,replica di col. arcobaleno,modelregenbooghertkever,модель радуж. жука-оленя,modèle de lucane copris,figura esc. ciervo arcoíris,rainbow stag model,modèle de lucane copris,figura esc. ciervo arcoíris,ニジイロクワガタのもけい,뮤엘러리사슴벌레 모형,彩虹鍬形蟲模型,彩虹锹形虫模型
InsectToy_07089,Maulwurfsgrillenmodell,mole cricket model,replica di grillotalpa,modelveenmol,модель медведки,modèle de taupe-grillon,figura de grillo cebollero,mole cricket model,modèle de taupe-grillon,figura de grillo cebollero,オケラのもけい,땅강아지 모형,螻蛄模型,蝼蛄模型
InsectToy_07090,Mega-Quelljungfermodell,grand b. dragonfly model,replica XL di libellula striata,modelbronlibel XL,модель кордулегастера,modèle de la Reine Libellule,estatua de libélula tigre,grand b. dragonfly model,modèle de la Reine Libellule,estatua de libélula tigre,おおいなるトンボのもけい,위대한 잠자리 모형,巨大蜻蜓模型,巨大蜻蜓模型
InsectToy_07091,Monarchfaltermodell,monarch butterfly model,replica di farfalla monarca,modelmonarchvlinder,модель монарха,modèle de monarque,figura de mariposa monarca,monarch butterfly model,modèle de monarque,figura de mariposa monarca,オオカバマダラのもけい,왕나비 모형,大樺斑蝶模型,大桦斑蝶模型
InsectToy_07092,Riesen-Hirschkäfermodell,giant stag model,replica coleottero gigante,modelreuzenhertkever,модель гигант. жука-оленя,modèle lucane cerf-volant,figura esc. ciervo gigante,giant stag model,modèle lucane cerf-volant,figura esc. ciervo gigante,オオクワガタのもけい,왕사슴벌레 모형,大鍬形蟲模型,大锹形虫模型
InsectToy_07093,Allotopus-rosenb.-Modell,golden stag model,replica di coleottero dorato,model-gouden-hertkever,модель лампримы,modèle de lucane lamprima,figura esc. ciervo tornasol,golden stag model,modèle de lucane lamprima,figura esc. ciervo tornasol,オウゴンオニクワガタのもけい,황금사슴벌레 모형,黃金鬼鍬形蟲模型,黄金鬼锹形虫模型
InsectToy_07094,Skorpionmodell,scorpion model,replica di scorpione,modelschorpioen,модель скорпиона,modèle de scorpion,figura de escorpión,scorpion model,modèle de scorpion,figura de escorpión,サソリのもけい,전갈 모형,蠍子模型,蝎子模型
InsectToy_07095,Zikadenlarvenhautmodell,cicada shell model,replica di esuvia di cicala,modelcicadehuid,модель кокона цикады,modèle de mue de cigale,figura de muda de cigarra,cicada shell model,modèle de mue de cigale,figura de carcasa de cigarra,セミのぬけがらのもけい,매미 허물 모형,蟬蛻模型,蝉蜕模型
InsectToy_07096,Singgrillenmodell,bell cricket model,replica di suzumushi,modelbelkrekel,модель домашнего сверчка,modèle de grillon du Midi,figura de grillo campana,bell cricket model,modèle de grillon du Midi,figura de grillo campana,スズムシのもけい,방울벌레 모형,鈴蟲模型,铃虫模型
InsectToy_07097,Nasenschreckenmodell,long locust model,replica di acrida cinerea,modelveldsprinkhaan,модель акриды,modèle d'acrida cinerea,figura de langosta alargada,long locust model,modèle d'acrida cinerea,figura de langosta alargada,ショウリョウバッタのもけい,방아깨비 모형,中華劍角蝗模型,中华剑角蝗模型
InsectToy_07099,Prachtkäfermodell,jewel beetle model,replica di stigmodera,modelprachtkever,модель златки,modèle de bupreste,figura de escarabajo joya,jewel beetle model,modèle de bupreste,figura de escarabajo joya,タマムシのもけい,비단벌레 모형,吉丁蟲模型,吉丁虫模型
InsectToy_07101,Vogelspinnenmodell,tarantula model,replica di tarantola,modelvogelspin,модель паука-птицееда,modèle de tarentule,figura de tarántula,tarantula model,modèle de tarentule,figura de tarántula,タランチュラのもけい,타란툴라 모형,狼蛛模型,狼蛛模型
InsectToy_07102,Marienkäfermodell,ladybug model,replica di coccinella,modellieveheersbeestje,модель божьей коровки,modèle de coccinelle,figura de mariquita,ladybug model,modèle de coccinelle,figura de catarina,テントウムシのもけい,무당벌레 모형,瓢蟲模型,瓢虫模型
InsectToy_07103,Wanderschreckenmodell,migratory locust model,replica di locusta migratoria,modeltreksprinkhaan,модель перелетн. саранчи,modèle de criquet pèlerin,figura langosta migratoria,migratory locust model,modèle de criquet pèlerin,figura langosta migratoria,トノサマバッタのもけい,섬풀무치 모형,飛蝗模型,飞蝗模型
InsectToy_07104,Bergzikadenmodell,walker cicada model,replica di cicala sputacchina,modelbergcicade,модель горной цикады,modèle de cigale cicadelle,figura de cigarra común,walker cicada model,modèle de cigale cicadelle,figura de cigarra común,ツクツクホウシのもけい,애매미 모형,寒蟬模型,寒蝉模型
InsectToy_07105,Geigenkäfermodell,violin beetle model,replica di carabo violino,modelvioolkever,модель жужелицы,modèle de mormolyce,figura de escarabajo violín,violin beetle model,modèle de mormolyce,figura de escarabajo violín,バイオリンムシのもけい,바이올린벌레 모형,提琴蟲模型,提琴虫模型
InsectToy_07108,Einsiedlerkrebsmodell,hermit crab model,replica di granchio paguro,modelheremietkreeft,модель рака-отшельника,modèle de bernard-l'ermite,figura de cangrejo ermitaño,hermit crab model,modèle de bernard-l'ermite,figura de cangrejo ermitaño,ヤドカリのもけい,소라게 모형,寄居蟹模型,寄居蟹模型
InsectToy_07109,Mega-Atlasspinnermodell,grand Atlas moth model,replica XL di farfalla cobra,modelatlasvlinder XL,модель павлиноглазки атл.,modèle Roi Papillon de nuit,estatua de polilla atlas,grand Atlas moth model,modèle Roi Papillon de nuit,estatua de polilla atlas,おおいなるガのもけい,위대한 나방 모형,巨大飛蛾模型,巨大飞蛾模型
InsectToy_07110,Elefantenkäfermodell,horned elephant model,replica di scarabeo elefante,modelolifantkever,модель жука-слона,modèle scarabée éléphant,figura esc. astado elefante,horned elephant model,modèle scarabée éléphant,figura esc. astado elefante,ゾウカブトのもけい,코끼리장수풍뎅이 모형,象兜蟲模型,象兜虫模型
InsectToy_07111,Kolibrifaltermodell,common bluebottle model,replica graphium sarpedon,model-blauwe-driehoek,модель графиума сарпед.,modèle graphium sarpedon,figura marip. triángulo azul,common bluebottle model,modèle graphium sarpedon,figura marip. triángulo azul,アオスジアゲハのもけい,청띠제비나비 모형,青帶鳳蝶模型,青带凤蝶模型
InsectToy_07112,Weiße-Baumnym.-Modell,paper kite butterfly model,replica farfalla carta di riso,modelpapiervlinder,модель идеи левконоя,modèle de grand planeur,figura marip. cometa papel,paper kite butterfly model,modèle de grand planeur,figura marip. cometa papel,オオゴマダラのもけい,왕얼룩나비 모형,大白斑蝶模型,大白斑蝶模型
InsectToy_07113,Japan-Schillerfaltermodell,great purple emperor model,replica farfalla imper. viola,model-paarse-keizervlinder,модель сасакии харонды,modèle de sasakia charonda,figura marip. emp. japonés,great purple emperor model,mod. gr. empereur pourpre,figura marip. emp. japonés,オオムラサキのもけい,왕오색나비 모형,大紫蛺蝶模型,大紫蛱蝶模型
InsectToy_07114,Japan-Rosenkäfermodell,drone beetle model,replica di cetonia dorata,modelbladsprietkever,модель бронзовки,modèle pseudotorynorrhina,figura esc. verde japonés,drone beetle model,modèle de cétoine dorée,figura esc. verde japonés,カナブンのもけい,풍이 모형,日銅鑼花金龜模型,日铜锣花金龟模型
InsectToy_07115,Mega-Giraffenhk.-Modell,grand giraffe stag model,replica XL coleottero giraffa,modelgirafhertkever XL,модель рогача-жирафа,modèle du Roi Lucane,estatua esc. ciervo jirafa,grand giraffe stag model,modèle du Roi Lucane,estatua esc. ciervo jirafa,おおいなるクワガタのもけい,위대한 사슴벌레 모형,巨大鍬形蟲模型,巨大锹形虫模型
InsectToy_07116,Gesichtswanzenmodell,man-faced stink bug model,replica di catacanthus,modelgezichtschildwants,модель щитника с лицом,modèle de catacanthus,figura chinche rost. humano,man-faced stink bug model,modèle de catacanthus,figura chinche rost. humano,ジンメンカメムシのもけい,인면노린재 모형,人面椿象模型,人面椿象模型
InsectToy_07117,Regenbogenfaltermodell,M. sunset moth model,repl. urania del Madagascar,modeladriandolo,модель урании мадагаск.,modèle chrysiridia rhipheus,figura de polilla crepuscular,M. sunset moth model,modèle d'adriandolo,figura de polilla crepuscular,ニシキオオツバメガのもけい,마다가스카르비단제비나방 모형,日落蛾模型,日落蛾模型
InsectToy_07118,Blaurüsselkäfermodell,blue weevil beetle model,repl. coleottero Schoenherr,model-blauwe-snuitkever,модель син. долгоносика,modèle de charançon bleu,figura de gorgojo azul,blue weevil beetle model,modèle de charançon bleu,figura de gorgojo azul,ホウセキゾウムシのもけい,유포루스바구미 모형,寶石象鼻蟲模型,宝石象鼻虫模型
